{
  "classification": "passed",
  "command": [
    "C:\\Program Files\\nodejs\\node.exe",
    "node_modules/@playwright/test/cli.js",
    "test"
  ],
  "config_fingerprint": "95db6e398b19034ffba108f15295b6410b44437eafd00832f0df6bda4b9dfcbc",
  "cycle": null,
  "diagnostics": [],
  "exit_code": 0,
  "files": {
    "context.json": "e74057ba913cb5b3923c099916d75d02a9f7fcc166a037d986a537be08461e03",
    "output.log": "31fae7294ed3adeda54a7b41a56b72102d8e033e732c46c6e8983c822d06b130",
    "raw-results": "9c4a0e3ba0f91bc3abd6b2238d6d1e52eb2ef176655444c49ce5c2dde0d7e226",
    "results.json": "d87e1b9054a00d843fa1e51e6b48de1547e11031ca38cd8f17842009ef223001",
    "specification.json": "a8ef836d3f4f0bf607da9008c8492559dd8c68976b2c0d7facc95309e3e1e84f",
    "specifications/.openspec.yaml": "7298a8d84b64912e18e677fa41d87e4da4e74e3a88d4bbd16f34211bb9a0249d",
    "specifications/specs/team-filter-result-count/spec.md": "d8a4d5be4df9ab88e7940dc336fc86fc6f8b86986a153541a75c7f4a02b2fdf8",
    "traceability.json": "4610dd331d6376a2a09fa9ea73054599090a77f5eb4add20eccea56d94bbc09e"
  },
  "finished_at": "2026-10-22T07:00:02.547047+00:00",
  "global_errors": [],
  "id": "2c3207bfee88491184edf7520be32104",
  "level": "e2e",
  "phase": "final",
  "previous_receipt_hash": "3e0e106d2dd3d476b9a3b87be35d5caa23d0bc945983fbfe24347f152465c2bc",
  "refactor_reason": "审视后计数实现保持单一循环、复用现有谓词；没有必要的结构重写，最终回归验证。",
  "requirements": [],
  "results": [
    {
      "attempts": 1,
      "container": "added-coverage-report.spec.js",
      "duration_ms": 1137.0,
      "evidence": "runs/2c3207bfee88491184edf7520be32104/results.json",
      "failure": "",
      "failure_kind": "none",
      "file": null,
      "level": "e2e",
      "locator": "added-coverage-report.spec.js::offline report shows true aggregates, both source statuses and optional D=0 files",
      "original_status": "passed",
      "parameters": "",
      "provider": "playwright",
      "run_id": "2c3207bfee88491184edf7520be32104",
      "status": "passed",
      "test_id": "c5569bebeaec3123ee0ce92394b0021262aef715b617f60ce8f68d3e2173e8f7"
    },
    {
      "attempts": 1,
      "container": "added-coverage-report.spec.js",
      "duration_ms": 527.0,
      "evidence": "runs/2c3207bfee88491184edf7520be32104/results.json",
      "failure": "",
      "failure_kind": "none",
      "file": null,
      "level": "e2e",
      "locator": "added-coverage-report.spec.js::keyboard, file search, line filters and copied line links work",
      "original_status": "passed",
      "parameters": "",
      "provider": "playwright",
      "run_id": "2c3207bfee88491184edf7520be32104",
      "status": "passed",
      "test_id": "52b9de168976baffb4f6c7e9d813380edd6df95654ce47bd5d3cc32bcc8704ac"
    },
    {
      "attempts": 1,
      "container": "added-coverage-report.spec.js",
      "duration_ms": 336.0,
      "evidence": "runs/2c3207bfee88491184edf7520be32104/results.json",
      "failure": "",
      "failure_kind": "none",
      "file": null,
      "level": "e2e",
      "locator": "added-coverage-report.spec.js::375px layout keeps page within the viewport and scrolls long code inside its panel",
      "original_status": "passed",
      "parameters": "",
      "provider": "playwright",
      "run_id": "2c3207bfee88491184edf7520be32104",
      "status": "passed",
      "test_id": "4fc83d64f59d18cadcf88bfb15661bb987b3799b13afa5896cd8f47c44b7a5c5"
    },
    {
      "attempts": 1,
      "container": "follow-teams.empty-retry.spec.js",
      "duration_ms": 5659.0,
      "evidence": "runs/2c3207bfee88491184edf7520be32104/results.json",
      "failure": "",
      "failure_kind": "none",
      "file": null,
      "level": "e2e",
      "locator": "follow-teams.empty-retry.spec.js::no follows and no matches are separate, and removing the last follow updates returning schedule",
      "original_status": "passed",
      "parameters": "",
      "provider": "playwright",
      "run_id": "2c3207bfee88491184edf7520be32104",
      "status": "passed",
      "test_id": "d9559ee5dda363400f060c0dd897ac0f2b2218be524cf260ba7aa7154c71f83e"
    },
    {
      "attempts": 1,
      "container": "follow-teams.empty-retry.spec.js",
      "duration_ms": 2418.0,
      "evidence": "runs/2c3207bfee88491184edf7520be32104/results.json",
      "failure": "",
      "failure_kind": "none",
      "file": null,
      "level": "e2e",
      "locator": "follow-teams.empty-retry.spec.js::schedule 503 retries without losing saved follows",
      "original_status": "passed",
      "parameters": "",
      "provider": "playwright",
      "run_id": "2c3207bfee88491184edf7520be32104",
      "status": "passed",
      "test_id": "2407b90a677c59f5b2f38f927f838808066e5039fbc089349934237d966f5c76"
    },
    {
      "attempts": 1,
      "container": "follow-teams.keyboard-race.spec.js",
      "duration_ms": 2837.0,
      "evidence": "runs/2c3207bfee88491184edf7520be32104/results.json",
      "failure": "",
      "failure_kind": "none",
      "file": null,
      "level": "e2e",
      "locator": "follow-teams.keyboard-race.spec.js::keyboard can follow, filter, select a stage and open a match with visible focus",
      "original_status": "passed",
      "parameters": "",
      "provider": "playwright",
      "run_id": "2c3207bfee88491184edf7520be32104",
      "status": "passed",
      "test_id": "d0a270997f0029796cd866140749c054d96ece3dcb8b2111056d82fb0f601268"
    },
    {
      "attempts": 1,
      "container": "follow-teams.keyboard-race.spec.js",
      "duration_ms": 5138.0,
      "evidence": "runs/2c3207bfee88491184edf7520be32104/results.json",
      "failure": "",
      "failure_kind": "none",
      "file": null,
      "level": "e2e",
      "locator": "follow-teams.keyboard-race.spec.js::rapid filter changes and reversed language responses leave the latest intent visible",
      "original_status": "passed",
      "parameters": "",
      "provider": "playwright",
      "run_id": "2c3207bfee88491184edf7520be32104",
      "status": "passed",
      "test_id": "dafb7b88378bdc356805de9b89e101005974d5645bdd0bfc82da0cd599212bf8"
    },
    {
      "attempts": 1,
      "container": "follow-teams.language.spec.js",
      "duration_ms": 5455.0,
      "evidence": "runs/2c3207bfee88491184edf7520be32104/results.json",
      "failure": "",
      "failure_kind": "none",
      "file": null,
      "level": "e2e",
      "locator": "follow-teams.language.spec.js::Chinese-English-Chinese preserves details, filters, results and static notice",
      "original_status": "passed",
      "parameters": "",
      "provider": "playwright",
      "run_id": "2c3207bfee88491184edf7520be32104",
      "status": "passed",
      "test_id": "aa0397aa36b39dfe082cc9245c93412078d74b08bb4412b0673b0c6da79a94a1"
    },
    {
      "attempts": 1,
      "container": "follow-teams.language.spec.js",
      "duration_ms": 5993.0,
      "evidence": "runs/2c3207bfee88491184edf7520be32104/results.json",
      "failure": "",
      "failure_kind": "none",
      "file": null,
      "level": "e2e",
      "locator": "follow-teams.language.spec.js::both empty states and unsaved warning translate in both directions",
      "original_status": "passed",
      "parameters": "",
      "provider": "playwright",
      "run_id": "2c3207bfee88491184edf7520be32104",
      "status": "passed",
      "test_id": "57a6b0d9194dbeb6e3b1837f5d7064c3cf7aeed62c76f2d1aa623542a67e665d"
    },
    {
      "attempts": 1,
      "container": "follow-teams.language.spec.js",
      "duration_ms": 4375.0,
      "evidence": "runs/2c3207bfee88491184edf7520be32104/results.json",
      "failure": "",
      "failure_kind": "none",
      "file": null,
      "level": "e2e",
      "locator": "follow-teams.language.spec.js::English full journey works without AI; controls fit a narrow screen in both themes",
      "original_status": "passed",
      "parameters": "",
      "provider": "playwright",
      "run_id": "2c3207bfee88491184edf7520be32104",
      "status": "passed",
      "test_id": "c2a17fd1fb0f7c3a748e8ca83fb498bd84f2366f3521babc32379203b61ee602"
    },
    {
      "attempts": 1,
      "container": "follow-teams.persistence.spec.js",
      "duration_ms": 2752.0,
      "evidence": "runs/2c3207bfee88491184edf7520be32104/results.json",
      "failure": "",
      "failure_kind": "none",
      "file": null,
      "level": "e2e",
      "locator": "follow-teams.persistence.spec.js::real UI follows two teams, removes one, refreshes and restores in a new page",
      "original_status": "passed",
      "parameters": "",
      "provider": "playwright",
      "run_id": "2c3207bfee88491184edf7520be32104",
      "status": "passed",
      "test_id": "c47e8efd9856d9e6cc31aafcfe74e56c8043780ad32f7dce08cb1e5e8b6ee46e"
    },
    {
      "attempts": 1,
      "container": "follow-teams.persistence.spec.js",
      "duration_ms": 1075.0,
      "evidence": "runs/2c3207bfee88491184edf7520be32104/results.json",
      "failure": "",
      "failure_kind": "none",
      "file": null,
      "level": "e2e",
      "locator": "follow-teams.persistence.spec.js::invalid team entries have no follow action",
      "original_status": "passed",
      "parameters": "",
      "provider": "playwright",
      "run_id": "2c3207bfee88491184edf7520be32104",
      "status": "passed",
      "test_id": "daa8f49cf575c2767c1915a080eb3a7b1712f52eda0320ca28f52c82fd811550"
    },
    {
      "attempts": 1,
      "container": "follow-teams.schedule.spec.js",
      "duration_ms": 5325.0,
      "evidence": "runs/2c3207bfee88491184edf7520be32104/results.json",
      "failure": "",
      "failure_kind": "none",
      "file": null,
      "level": "e2e",
      "locator": "follow-teams.schedule.spec.js::follows combine with stages and survive same-tab return, refresh resets only filters",
      "original_status": "passed",
      "parameters": "",
      "provider": "playwright",
      "run_id": "2c3207bfee88491184edf7520be32104",
      "status": "passed",